noHate	noHate	Welcome to Stormfront , the largest White Nationalist community on the web .
hate	hate	- `` Something about black '' and the old favorite `` Once you go black you never go back ''
noHate	noHate	This whole situation starts to become really bizarre .
hate	hate	Why not just kick out all those Africans ?
noHate	hate	The Official Website of the British People 's Party A few unpleasant truths re. the zionist ass lickers of the DUP
hate	noHate	I do n't think anyone is insinuating that we are equal to non whites , or that we would ignore white nations .
noHate	noHate	Hi, I am 26yo from Glendale AZ .
noHate	noHate	Pure .
hate	hate	A public execution for these animals would go a LONG way to point to justice being done ; it would never bring the girl back ; but I guarantee it would send a message ............................
noHate	hate	Oh yeah , no mugshot picture on the page of course , you have to watch the video report to find out it was yet another case of TNB .
hate	hate	I do not think anyone looks up to white Negroes , just the black ones and then they become wiggers .
noHate	noHate	Seattle bus attack on a blind woman : YouTube - Broadcast Yourself .
noHate	noHate	The work involves : selling sporting goods and assisting customers with questions or problems .
hate	noHate	Some of them claim that they would like to go back home one day but after a few years in Finland they will no longer have this wish .
hate	noHate	More than that I cringe every time I go to hang out with my friends and they blast this filth in their cars and homes .
hate	hate	Most of these videos belong on the Animal Planet tv channel .
hate	noHate	And meanwhile , Gerry Gerry Dingleberry is trying to kill off future generations of Irish .
noHate	noHate	I was trying to find out if the Egyptians were white or not and my search brought me to a thread on this site .
hate	noHate	That has been proven many times over by the Jew media in the U.S !
noHate	noHate	Pretty soon , there 's not going to be anywhere left to run .
noHate	noHate	White speech is Hate ....
hate	noHate	Comparing these pictures to pictures with serbs I do n't see much difference between them and albanians , the same Dinaric and Mediterranean subtypes .
noHate	noHate	There have been more people coming on this board that live in the central Wisconsin area since I have started coming on here .
hate	noHate	I take the assumption that your Nation is so crap is not worth remembering .
hate	hate	Did they put that Groid 15 next to Rooney just to make Rooney look at least half-human ?
hate	hate	I just refer to them as primates as through THEIR evolution process they are just a little bit higher on the evolutionary chain which makes them all the more dangerous to whites , than any of their animalistic cousins .
hate	hate	What I do know is that I live on a small Island and it seems that a lot of people from various countries in the world are willing to desert their homelands and their families just to come here , in my mind that tells me a lot about said people and their home countries , most of all it highlights their weaknesses of how their own countries have let them down and how they feel the need to feed off somebody elses country , how should we English interpret this without sounding rude ??? , locust ??? , parasite ??? , you tell me .
noHate	noHate	I 'm hoping things will continue to grow with our smaller meets and will make for a good turn out at our events this year !
hate	hate	Sadly, I think the government would step in if we tried to stop the lesser races from moving into our land .
hate	hate	Then we can all live in a global utopia with the Jew running the show - cant wait Nothing short of a brain transplant is going to raise a Negroes IQ .
hate	hate	Most white girls are taught and brainwashed to love black guys , only way is to properly educate them and show them what savages they truly are .
noHate	noHate	Hi i have not been on here in ages .
noHate	noHate	Wolf 278
noHate	noHate	Enjoy your classroom .
hate	hate	I bet they wouldnt have done that crap to a black person that had black power or those black fists that the panthers use written on his back pack .
hate	hate	They laugh at whites who obey the law , bother to get married , women who are chaste .
noHate	noHate	They 're music is one of the reasons I decided to become a white nationalist in the first place .
hate	hate	They 're probably as high-maintenance as one of those crappy old East German Trabants , though .
hate	noHate	And my job lets me monitor all of Jewish supremacist control of talk radio .
hate	hate	It makes my flesh crawl when I see white girls having to be felt up as they walk down the hallways by big lipped spear chuckers. : attack
hate	hate	It just goes to show that the IRA are just criminals and not freedom fighters as they claim .
hate	hate	The majority of them are as stupid as real Negroes .
noHate	hate	If it 's black , send it back .
hate	hate	Those in the countries you mentioned are the mongrel offspring between whites ( Aryans ) and Arabs and its funny how those of the East who claim to be the Aryans talk about white people who came and mixed with them and the only Aryans apparently in the East are those with light skin and blue eyes .
hate	hate	The Black race is yet to invent any kind of civilization .
hate	hate	The future is ours , as long as we do not sit by and wait to be overrun by the subhumans .
noHate	noHate	saysay.jpg say say with a candle 2.jpg This is my nearly 3 year old cat called Say-Say .
noHate	noHate	I really do hate rap music .
noHate	noHate	See the new thread @ https : //www.stormfront.org/forum/t989503/
noHate	noHate	Sometimes I do watch shows about WWII on the History channel but other than that I never watch it .
noHate	noHate	It 's a pretty powerful documentary that blew me away .
hate	hate	Like the parasites they are they simply moved to a new host , to continue their destruction of Western White civilization and culture
hate	hate	Their lies are so thick and many that people do n't see the truth when it is in front of them !
hate	noHate	We knew that these structures were built by sub-saharan blacks in the same way we knew that the civilization Greek and Romanian built by white Europeans .
