noHate	noHate	It offers certificates of completion for many courses .
noHate	noHate	Great link .
hate	hate	Why do n't White Europeans and Americans grow a set of balls , and deport these Black and brown animals from their countries ?
noHate	noHate	Its time for the return of Mosley 's blackshirts .
noHate	hate	Jews have been poisoning wells since Biblical times .
noHate	noHate	haha; im a 19 y.o white male from newcastle area - but im moving back to sydney very soon ( west sydney im afraid lol )
noHate	noHate	Whether or not one chooses to eat meat is a very personal decision .
hate	noHate	I do get my Theirs , theres and they 're , mixed up sometimes but i was educated under Labours rule so i cant be completly to blame .
noHate	noHate	- = Wulfi = -
hate	noHate	We are cooking a duck on the rotisserie , catch the fat drippings and cook little potatoes in that , its delicious , we 're also cooking a small turkey , mashed potatoes , carrots , pumpkin pie and butternut squash cut in half and baked with butter and brown sugar .
noHate	noHate	Absolutely.
noHate	hate	Hi Im tv free do n't have kids yet reading mending , sewing , menting board games radio study extra curricula actives Good on you for planning a FREE jewv existence
noHate	noHate	It 's more fun that way , too .
hate	hate	It's weird most Indians dot and to an extent feather that I deal with hate blacks more than they do whites and find blacks to be lazy and worthless .
noHate	hate	some times Whites are forced to live around a lot of blacks .
noHate	hate	I always thought it would be cool if somebody covertly set off a nuke in Kashmir , and then we all could sit back and watch as the Paki 's and Indians nuke the scheiss out of each other .
hate	hate	I'm glad you pointed this out that anti-Bullying campaign has been used to promote homosexuals who are more likely to bully anyone who disagrees with them .
noHate	hate	This guy seems to get it but otherwise : Sorry jigs , you 're on your own
noHate	noHate	Please stop this nonsense all of you !
noHate	noHate	I 've seen shots with a .45 , where people walked around angry .
noHate	noHate	I live in a suburban area with an old spring fed lake that always has water in it .
noHate	noHate	My buddy 's boat is anchored beside it .
hate	hate	you just say blacks hate the cold. the only reason they are good athletes is because when you have to run lions and tigers you get fast or eaten .
noHate	hate	These ' niggas ' .
hate	hate	Americans and Irish understand each other better than Spaniards and the beaners .. the US and Ireland are the 1st world so they are educated unlike the beaners .
noHate	hate	I considered it being `` ethnically cleansed '' from my childhood home
noHate	hate	Blacks hate whites .
noHate	noHate	It was probably written by a 15 year old .
noHate	noHate	Everything is machined to well today mlst stuff is plug and play .
noHate	noHate	www.sjca.edu St. John 's College , Santa Fe , N.M.
hate	noHate	Of course the county is lovely , in facts its gods country in our book BUT the cities are rat infested with enrichers , just how the country is isnt it .
noHate	noHate	you gotta stand up for yourself you cant just sit back and take their * * * * but on the other hand you cant go out looking for it either but if it comes down to a fight dont back down
hate	hate	Back when I was a kid , even the black folks called them that .... `` Ooohhh I' z cai n't wait until Crimusz , I' z gonna get me sum of dem niggah-toes and oranguz fo ' Crimusz , an ' sum peppahmintz ; dey shoa iz gud ! ''
noHate	noHate	At the resturant , the Pres. of Hamms orders a Hamms , the Pres. of Schlitz orders a Schlitz , the Pres. of Budweiser orders a Bud , and the Pres. of Guiness orders a cup of tea .
hate	hate	Laugh it up ape cause without yt to protect your race Asians will probably do the world a favour and wipe your kind from the face of the Earth .
hate	hate	Maybe they will be resettled deliberately as refugees or maybe they will come for the women like the chinese men are doing .
noHate	noHate	I hear that McDonalds is coming to their aid .
hate	hate	I heard about it is it about that white guy that killed that race traitor slut and her nig nog boyfriend ?
hate	hate	An Irish prison is like a luxury hotel where they come and thats even if they get sent to prison and thats if they get do n't flee the country and thats if they get caught doing the crime ... so crime does pay in Ireland .
noHate	hate	Back to where ya came from !
hate	hate	This family that wants to complain about gays should come to San Francisco and raise some hell at these gay pride events .... a much better target ..... and these people in San Francisco openly blasphemied Christ with their parody of ' The Last Supper `` as their poster for their last event .
noHate	noHate	I've tried to meet for coffee with a few people but everybody is really spread out , it 's tough to find the time to go out and meet like minded people .
hate	noHate	I was sure that they were lying about the numbers and it 's must be the same in every country IMO .
hate	noHate	We say here that if we want to be lied to just watch the news !
noHate	noHate	Now i just dont know what to do or think anymore .
noHate	noHate	Sardines and anchovies , for example , are basically 100 % safe .
hate	hate	ZOG is getting rid of every White-dominated area in the world .
hate	hate	We need to deport all nonwhites immediately , that or stop letting more in and sterilize the ones here , that will fix the problem .
hate	hate	Only a f' n jew would have the nerve to hide away in a black country , a fugitive from US law , while making campaign promises at the same time as suing the company he defrauded .
hate	noHate	These people who want foreign aid increased are the same people who walk past irish people living rough on the streets and they do n't care about the old people who the government ignores .
hate	hate	Lay her off and cart her back to India where she can poop in the Ganges river next to her dead grand parents .
hate	hate	In the eyes of the Jew and the libtard there is a race problem and the problem is us !
noHate	noHate	Richland County deputies say Cason killed his estranged wife , 38-year-old Letitia Cason , at an apartment on Smallwood Road in Northeast Richland County Deputies : Murder Suspect Shoots at Officers , is Taken Into Custody wltx.com | Columbia , SC News , Weather and Sports |
hate	hate	I am sure California is full of sick self hating whites , who think that for the good of all the black brown and yellow peoples of the world , whites need to commit racial suicide and disappear from their face of the earth for their sake and wo n't that be just dandy !
noHate	noHate	But millions can believe a lie for centuries upon centuries , especially when you make investigating the story a crime .
noHate	hate	Ethnic crime never ends it seems .
noHate	noHate	But it does have a feminine sound .
noHate	noHate	I am going to try and update my site soon , I did however add a chat room .
noHate	noHate	You are joining a unit that is famous for its great spirit and effectiveness at awakening our kinsmen .
hate	hate	Why would they let blacks live ?
hate	noHate	Hey, do you think we are going to get into a fight between European countries about who all are going to get those Guantanamo prisoners ?
hate	hate	They will eventually kill off the whites and go back to the jungle ways .
hate	hate	Exactly, they want us to lay down and die .
hate	hate	Explain how liberals are liars and anti-White and tell her about crime statistics .
noHate	noHate	Has anyone claiming this method been able to make even one block like that with wedges water and copper tools ?
noHate	noHate	Its got to be a quote from someone .
noHate	hate	Dude stink bomb this event , when it gets dark , chuck a bunch of them on the floor , different spots , when the chimps start jiving and grooving , they will step on them .
hate	hate	why did god give negroes good rhythm ?? because he messed up their lips , hair , nose and skin so yes they are ugly !!!!!!!!!!!!!!
hate	hate	I'm heading down to DC to put a sign on the White House gates that will read : ' No savage negro BEASTS in the White House ! '
noHate	noHate	This is my next read .
hate	hate	The chairman of the FA is one David Bernstein and , yes , he is a member of a certain tribe that delight in bringing diversity and the benefits of multi-culturalism and ' anti-racism ' , along with boatloads of third-worlders to Britain .
noHate	noHate	hey whats up i 'm new on here and i would like to have someone to talk to so hit me back for whatever
hate	hate	They need the white male distracted as much as possible and of course the glorification of the groid ; two birds one stone .
hate	hate	In all likelyhood , it 's jews painting the road of skank for her to follow .
hate	hate	Even if they do stop pouring in most of those that are here have no intention of going back to poland .
hate	hate	And now this clip suggests they were suffering by having to live among heartless and barbarian Whites .
noHate	noHate	What did those poor monkeys ever do to you ?
noHate	hate	As a nation , we are in desperate need for an immigration time out and a zero tolerance policy for those here illegally .
hate	hate	I would like to say and I can proudly say that there are no jews in Iceland , those that tried to get here were all sent back to Germany ...
noHate	noHate	The ability to run really quietly and lots of chloroform .
noHate	noHate	A 750 lb boat with a 280 hp motor .
hate	hate	Then we will see who is afraid to leave thier homes after dark or venture into the wrong ' hood .
noHate	noHate	My favorite part : And still he ca n't see the truth right in front of his face .
hate	hate	When I was last time in South Africa , we went to Sun City and saw little black monkey children swimming , funniest thing was watching drying water off their faces , it looks exactly like baboon or something , way they do it , whites have certain mannerisms with doing things , they have completely ape-like ones .
hate	hate	All you need is to cut off it 's head and the rest of the problems will crumble away with ease
hate	hate	DuetschGirlTX, No I live in a tiny ass town where i am only one of 100 white folks ( maybe less ) . near San Antonio. there are so many dirts around and they all stick together. so when it comes to a White Girl in this town i gotta have my own back ALWAYS Is that where you are ?
noHate	noHate	Please let me know if there is anything I can do .
noHate	noHate	Was n't Bill Clinton the first `` black '' president ?
hate	hate	Hopefully they will leave YT alone and just deal with the Nigerians when they start chimping out in the streets .
noHate	noHate	damn! at least that sounds more plausable than a stupid sea. maybe look on ebay ??? are u sure there is none left ???
noHate	hate	You Anglo-Americans are all welcome to England if you can perform the ' small ' task of riding London of it 's ethnics !
noHate	noHate	I would love a house .
noHate	hate	Maybe God was punishing them for their interracial marriage .
noHate	noHate	Now I get it !
noHate	noHate	No .
hate	hate	I am not going to be beat down by a dyke , fag , or coon .
hate	hate	There are so many race mixing ads on TV that it gets overwhelming .
noHate	hate	On a short holiday , Go back and do something about your own country and stop putting crap on our doorstep !
hate	hate	By their words and deeds , they declare themselves to be staunchly in favor of the genocide of our people .
hate	hate	Israel arrests him i bet Lentin and co are very happy.All students looking in see what scum the Jews are.Details here www.normanfinkelstein.com
noHate	noHate	If you come down n ' around Sacramento California area send me a message .
hate	noHate	now that ye mention it he does look a bit like this traveller i knew. i wonder if we gave him a wash would he really be a white guy with red hair ?
noHate	noHate	Any bother u go on lock down no one gets out the cells so its not that bad prison is 24 hour boredom ..
hate	hate	The problems start when you start to accommonadate these people in the first place ! , give an inch and they 'll take a mile ......
noHate	noHate	Ya got a virgin shooter .
noHate	hate	I got sloppy seconds after some Muslims used this girl .
noHate	hate	To me it means that Jewish supremacists will never again allow Whites to have a say .
noHate	noHate	You need to ask this when the Obama Administration instructed the IRS to target conservatives ?
noHate	hate	Keep Russia free from dark skinned beings !!!! thank you and please forgive me for mistakes .
noHate	noHate	INTJ Introvert ( 11 % ) iNtuitive ( 38 % ) iNtuitive Thinking ( 38 % ) Judging ( 22 % ) You have slight preference of Introversion over Extraversion ( 11 % ) You have moderate preference of Intuition over Sensing ( 38 % ) You have moderate preference of Thinking over Feeling ( 38 % ) You have slight preference of Judging over Perceiving ( 22 % )
hate	hate	I could never picture the site of one of the women of the Holy Rus shacking up with some Islamic mud from that fithy , impoverished , and godforsaken mountainous * * * * hole !
hate	hate	The kikes probably put the Leftist up to it , to make it seem like they do n't have total control of everyone .
noHate	noHate	2 .
noHate	noHate	I take it you are a little person then .
noHate	noHate	if they have the same help here in Quebec , i would like too say congratulation pitbull-A.G. and i hope you have lot of new white resident in your city
hate	hate	I 'm angry against myself for just letting this whole world drown into a jewish cesspool .
noHate	noHate	When the homos tried to have a fag pride parade in Serbia a few years ago they were beaten up .
noHate	noHate	Neither of the Diaz brothers are very bright but they generally come to fight .
hate	hate	You can stop this by getting a dead pig and bury it underground where the mosque will be built .
noHate	hate	It 's going viral on Youtube - warning the lesbian ' groid gets aggressive on the whites for whatever reason : YouTube - Video Caught On Tape Lesbian Or Young Man Going Wild On BART Train In Oakland !
noHate	hate	If you want to hear what a black `` intellectual '' ( lol ) sounds like , check out the woman in this video trying to debate Dr. William Shockley .
noHate	noHate	And some people say that the Klan is n't doing anything today to make a difference .
noHate	noHate	Hello Everyone on Stormfront Have heard a lot of good things about this forum so I have decided to take the plunge .
noHate	hate	Check out this youtube channel i found , i agree with most of what he says Diversity DESTROYS Social Cohesion in the West - YouTube
noHate	noHate	I'm too lazy to reread , did he say ' Teacher `` or '' Teacher 's asst . " ?
noHate	noHate	14 !
noHate	hate	They do what they always do take something of someone else 's and make it their own .
noHate	noHate	I remember when I was at my college during the Holidays ... every single holiday would be mentioned loud and clear except for Christmas ... especially kwanzaa .
noHate	noHate	Only scored a 120 .
hate	hate	Those boys will use the plastic whisks as swords , and the girls ' lego creations will consist of dollhouses for the few white dolls , with the dark ones in the adjoining farm pen .
noHate	noHate	Oh, I forgot to say where I lived .
hate	hate	While they are in prison the kikes should get the same food the regular prison population gets ...
noHate	hate	If I was Ukrainian , I 'd sign a pact with devil himself to get rid of jewdo-islam Putinistan AKA Russian Federation ....
noHate	noHate	After knocking back a few guinness we got pretty hungry and he said he knew a great place to go get some food , i was disgusted when he brought me to a chinese restaurant .
hate	hate	The White race is best because when the Creator made Whites , He made them better than He made the other races .
hate	noHate	Here are the CDs I want to sell : Beethoven : Symphonies Nos. 5 & 7 - Kleiber Beethoven : Symphony No. 9 - Furtwangler Bruckner : Symphony No. 9 - Furtwangler Handel : Music for the Royal Fireworks ; Water Music - Marriner Howard Hanson : Orchestral Works - Schermerhorn J.S. Bach : Great Organ Works - Hurford Norwegian Classical Favorites - Engeset The Best of Baroque Music - Edlinger Twilight of the Gods : The Essential Wagner Collection - Dorati , Karajan , Sinopoli , Bohm , Gerdes , Kubelik Most of these were recommended by fellow Stormfronters .
noHate	hate	I'm not sure what sort of information you 're seeking but I recently found a number of Blacks who have been convicted for knowingly transmitting HIV/AIDS : Kouassi Adaye http://news.bbc.co.uk/2/hi/uk_news/e...de/3389735.stmJohnsonAzigahttp://en.wikipedia.org/wiki/Johnson_AzigaStanislasKanengele-Yondohttp://en.wikipedia.org/wiki/Stanislas_Kanengele-YondjoTrevisSmithhttp://en.wikipedia.org/wiki/Trevis_SmithAdrienSylverNduwayohttp://www.thenownews.com/issues06/0...031206nn2.htmlWillieAtkinshttp://www.dallasnews.com/sharedcont....32a4d9fd.htmlNushawnWilliamshttp://en.wikipedia.org/wiki/Nushawn_WilliamsSimonMolhttp://en.wikipedia.org/wiki/Simon_MolEversonBandahttp://www.dailymail.co.uk/pages/liv...=5&expand=truePeterMwaihttp://www.crime.co.nz/c-files.asp?ID=36WilliamKaranjahttp://www.amren.com/mtnews/archives...n_rapist_j.phpLinkoyMuhurihttp://news.bbc.co.uk/2/hi/uk_news/e...on/3256352.stmMohammedDicahttp://news.bbc.co.uk/2/hi/uk_news/e...on/3190626.stmFestonKonzanihttp://news.bbc.co.uk/2/hi/uk_news/e...es/4267433.stmGabrielVengesaihttp://www.dailymail.co.uk/pages/liv ... n _ page _ id = 1770
hate	hate	Blacks in South Africa wondering why their country is going to hell when they put Blacks in charge .
hate	noHate	I have one word for you ....... MOVE . We chose this area because we wanted our children to go to all white schools .
noHate	noHate	I was just debating with myself whether I should go to bed or have one last beer ...
hate	hate	They will kill there own just as fast as they would kill there enemy .
hate	hate	Then again , in this modern age of white youth emulating negroes and white adults groveling at the feet of the juden , perhaps it 's an appropriate word after all .
hate	noHate	I'm in Australia and I want it to be done and over with , my mum is constantly going on about the Olympics like it 's a big deal .
hate	hate	Hi everyone .... I 'm from Slovenia and I utterly hate every living muslim in this world ....... and I despise even the dead ones
hate	hate	Whites have the following Too many abortions , too many mixed marriages , too many no kids marriages , and too many liberals .
hate	hate	Those poor kikes they cant even escape antisemetism in the country were it is punishable by death ( I am talking about palestinians )
noHate	noHate	Has anybody pointed out that Finland is n't part of Scandinavia yet ? ( Hur gick det i Finnkampen , vet ni det ?
noHate	noHate	Providing From Finland does n't kick my ass and throw me overboard ... coming or going .
hate	hate	So sick of the way its working , I remember when I was growing up in Winnipeg the little shops were all white runned and owned and would hire people from the community and it was great it helped people and kept streets safe even though me and others would cause some bull * * * * it wasnt anything to how it is now .
noHate	noHate	Everyone on my MSN gets all manner of pics ( ) but I 've never put any up here so here goes Some pics from about a year ago and a small anigif from a week ago heh Robin
noHate	hate	I just need to turn on a tv and I see it advertised everywhere , mostly African apes with attractive white woman .
hate	hate	There have been times when I have walked past some nigerian or skinny and they will cough with hand at their side without care for those around them .
noHate	noHate	Lets keep it that way and not destroy it Check out this ice cave in Dobšiná Its frigging cold in there
hate	hate	Wasn't there something like a big bang in which a burrito exploded and all the beans flew everywhere and started reproducing exponentially ?
hate	hate	Well, at least these dumb negroes got the fact that Jews are evil right ; though I suspect whitey and the jews are one in the same to their primitive minds ...
noHate	noHate	Slavic peoples make up some 34 % of European population .
noHate	hate	Too many libtards , I would n't waste my time there .
hate	noHate	Notice the video title , whenever there is a fight between a white and non white , the white is always the racist
noHate	hate	God forbid anyone should promote straight racially loyal hetrosexuality Diablo
noHate	noHate	There are only eight people living within a mile of my house , and none closer than a quarter-mile .
hate	hate	Of course , they are more virile than us , so that would n't happen would it ?!!!
noHate	noHate	TY!
hate	hate	The red scum will never wake up , ignorant lefties fight for `` their class '' when their making a mockery of their culture and heritage . commie scum ..
hate	noHate	These people have no idea about who they are or where they came from and any knowledge that they do have has guilt attached to it .
hate	noHate	Our country is being over run and people let it happen just because the political issue here seens to take over the racial one .
noHate	hate	More impulsive Negro stripping ...
hate	hate	Nearly everything if not all acts that the liberals carry out damage this nation and our people .
hate	hate	The only good thing about Indians is their married women are so loose that prostitution fails in Indian areas .
hate	hate	Tralee is a disgrace , the place looks like a town in africa nowThe day Ireland becomes a muslim country is the day i stop breathing !
noHate	noHate	Hi i need some information to understand the meaning of the negrogreek homo and the race-mixer tag of the HELLENIC THREAD .
noHate	noHate	More black-on-white hate crime videos are posted here : http://ethniccrime.blogspot.com/p/ra...-on-video.html
hate	hate	Except , of course , for those that pander to the filthy sons and daughters of Satan like ' ol Sandra here .
noHate	hate	If that stopped the worthless thing would starve !
hate	noHate	Lions , Tigers , Cheetahs , etc are all cats but they ai n't the same .
hate	noHate	I've told my friends and all of them agree with me ( some only partially ) .
noHate	hate	I heard from friends in Boston this is true.Blacks will attack an Irish America with a shamrock tattoo.How long before this happens in Ireland ?
noHate	noHate	great posts. see how the media has been lying to us for decades about what actually happened and what it was actually all about .
noHate	noHate	Right.
noHate	noHate	I do n't think so .
hate	hate	Teach our men to be men again and defend our countries and women folk against the non white .
noHate	noHate	nice to see another maritimer , the south shore is a beautiful place , i ride down that way a lot on my harley , i live in the annapolis valley .
noHate	noHate	I 'll be at that show AND I 'm a brunette .
noHate	hate	When I watch things like this I pray God will have vengeance on these sub humans even if they have asked for forgiveness .
noHate	hate	To hell with what this creature thinks anyway .
noHate	noHate	BTW .. update coming soon with info on my drive back to Florida .
hate	noHate	the money he is giving away to refugees and the third world is money Canada does not even have !
hate	noHate	I got stuck next to a really huge black woman who stunk to high heaven , and spent the entire ride with my face as close to the window as I could get .
noHate	noHate	I see pro and cons of both .
noHate	hate	Like I said before I 'd bet 90 % + have Liberal parents .
hate	hate	18 times in the last 20 years It 's time for the next generation to fight back to regain our country ..... the baby boomers will lose it for us if we do nothing .
hate	hate	How much longer are we going to wait for them to take care of themselves ?
hate	hate	The white man has no future in Canada , that is for sure , because the country is being flooded with non-white immigrants .
hate	hate	I will at least never willingly pay to see this propaganda , maybe just watch it for free to show the influence the jews have got in the white genocide to people .
hate	hate	I have a dream - one of these days Black occupation of America will be history !
hate	hate	I think it is a bit late to think to look after the safety and the future of white people in South africa .
hate	noHate	I 've taught her to question everything that they teach her .
hate	hate	In Eternal Combat with that Satanic Spirit - The physical incarnation , creation of the Demiurge : The Jews .
hate	hate	The problem is that through western elites we have to feed and look after useless savages like malema .
hate	hate	what about it. that 's exactly what I said and I meant every word he thought I might and that was enough and with you two talking behind my back like some jew what do you expect me to say have a nice life .
hate	hate	Instead it is the athletic negro Holyfield 11 kids , Mike Tyson 7 kids , Riddick Bowe 5 kids , George Foreman 10 kids who procreate like apes and spread these athlete genes along .
noHate	noHate	Listening now .
hate	hate	Its only a matter of time until we become a hell hole like Sweden or the UK .
noHate	hate	That 's to assume the gay ones are n't abusive .
hate	hate	This is the argument homosexuals use to justify their behavior , that because there are no `` red letters '' about it , then homosexuality is not a bad thing .
noHate	noHate	I believe Abraham 's faith was tested by God when he asked him to sacrifice Isaac , the quran falsely claims it was Ishmael .
noHate	noHate	This is where their `` I 'm a bad ass , I can do whatever I want '' attitute comes from .
noHate	noHate	First off they probably wont do anything , second off dont start anything .
hate	hate	Both Asians and whites are composed and calm and blacks seem to have no self control .
hate	noHate	That type of negroes call your kind of brothas , Uncle Tom .
